{
  "artifact_id": "TIBER_IDENTITY_CROSSWALK_V1",
  "schema_version": "v1",
  "generated_at": "2026-06-08T00:00:00Z",
  "supported_providers": [
    "sleeper"
  ],
  "coverage": "seeded_operator_verified_mappings_only_not_full_player_universe",
  "record_count": 3,
  "records": [
    {
      "provider": "sleeper",
      "provider_player_id": "6797",
      "provider_canonical_id": "sleeper:6797",
      "tiber_player_id": "tiber-data-player-2025-justin-herbert",
      "player_name": "Justin Herbert",
      "position": "QB",
      "team": "LAC",
      "confidence": "exact",
      "match_method": "verified_manual_seed",
      "source": "operator_verified_management_smoke",
      "source_updated_at": "2026-06-08T00:00:00Z"
    },
    {
      "provider": "sleeper",
      "provider_player_id": "9493",
      "provider_canonical_id": "sleeper:9493",
      "tiber_player_id": "tiber-data-player-2025-puka-nacua",
      "player_name": "Puka Nacua",
      "position": "WR",
      "team": "LA",
      "confidence": "exact",
      "match_method": "verified_manual_seed",
      "source": "operator_verified_management_smoke",
      "source_updated_at": "2026-06-08T00:00:00Z"
    },
    {
      "provider": "sleeper",
      "provider_player_id": "9509",
      "provider_canonical_id": "sleeper:9509",
      "tiber_player_id": "tiber-data-player-2025-bijan-robinson",
      "player_name": "Bijan Robinson",
      "position": "RB",
      "team": "ATL",
      "confidence": "exact",
      "match_method": "verified_manual_seed",
      "source": "operator_verified_management_smoke",
      "source_updated_at": "2026-06-08T00:00:00Z"
    }
  ]
}
